{
  "id": "01JABCDWORK0000000000000001",
  "type": "bug",
  "title": "Checkout button does nothing on Safari",
  "requester": {
    "kind": "person",
    "id": "slack:U024BE7LH",
    "displayName": "Varun"
  },
  "origin": {
    "source": "slack",
    "url": "https://acme.slack.com/archives/C01/p1700000000000200",
    "externalId": "1700000000.000200"
  },
  "dedupeKey": "slack:C01/1700000000.000200",
  "surface": "checkout",
  "priority": "high",
  "links": [
    {
      "url": "https://sentry.io/acme/issues/42",
      "title": "TypeError in checkout.js"
    }
  ]
}
